{
  "event_id": "evt_018f6b2a-7c3a-7d30-8f3a-9c0b1d2e3f43",
  "schema_version": "0.3-draft",
  "run_id": "run_018f6b2a-7c3a-7b10-8f3a-9c0b1d2e3f41",
  "sequence": 1,
  "subject_id": "run_018f6b2a-7c3a-7b10-8f3a-9c0b1d2e3f41",
  "occurred_at": "2026-10-21T01:22:00Z",
  "event_type": "run.accepted",
  "payload": {}
}
